[
  {
    "transfer_id": "TRF-10000000-0000-4000-8000-000000000001",
    "betrag": "450.00",
    "typ": "intern",
    "abgang_transaktion_id": "TXN-00000000-0000-4000-8000-00000000000d",
    "zugang_transaktion_id": "TXN-00000000-0000-4000-8000-00000000000e"
  },
  {
    "transfer_id": "TRF-10000000-0000-4000-8000-000000000002",
    "betrag": "100.00",
    "typ": "intern",
    "abgang_transaktion_id": "TXN-00000000-0000-4000-8000-00000000000f",
    "zugang_transaktion_id": "TXN-00000000-0000-4000-8000-000000000010"
  },
  {
    "transfer_id": "TRF-10000000-0000-4000-8000-000000000003",
    "betrag": "393.00",
    "typ": "intern",
    "abgang_transaktion_id": "TXN-00000000-0000-4000-8000-000000000011",
    "zugang_transaktion_id": "TXN-00000000-0000-4000-8000-000000000012"
  },
  {
    "transfer_id": "TRF-10000000-0000-4000-8000-000000000004",
    "betrag": "450.00",
    "typ": "intern",
    "abgang_transaktion_id": "TXN-00000000-0000-4000-8000-000000000020",
    "zugang_transaktion_id": "TXN-00000000-0000-4000-8000-000000000021"
  },
  {
    "transfer_id": "TRF-10000000-0000-4000-8000-000000000005",
    "betrag": "100.00",
    "typ": "intern",
    "abgang_transaktion_id": "TXN-00000000-0000-4000-8000-000000000022",
    "zugang_transaktion_id": "TXN-00000000-0000-4000-8000-000000000023"
  },
  {
    "transfer_id": "TRF-10000000-0000-4000-8000-000000000006",
    "betrag": "412.00",
    "typ": "intern",
    "abgang_transaktion_id": "TXN-00000000-0000-4000-8000-000000000024",
    "zugang_transaktion_id": "TXN-00000000-0000-4000-8000-000000000025"
  },
  {
    "transfer_id": "TRF-10000000-0000-4000-8000-000000000007",
    "betrag": "450.00",
    "typ": "intern",
    "abgang_transaktion_id": "TXN-00000000-0000-4000-8000-000000000033",
    "zugang_transaktion_id": "TXN-00000000-0000-4000-8000-000000000034"
  },
  {
    "transfer_id": "TRF-10000000-0000-4000-8000-000000000008",
    "betrag": "100.00",
    "typ": "intern",
    "abgang_transaktion_id": "TXN-00000000-0000-4000-8000-000000000035",
    "zugang_transaktion_id": "TXN-00000000-0000-4000-8000-000000000036"
  },
  {
    "transfer_id": "TRF-10000000-0000-4000-8000-000000000009",
    "betrag": "261.00",
    "typ": "intern",
    "abgang_transaktion_id": "TXN-00000000-0000-4000-8000-000000000037",
    "zugang_transaktion_id": "TXN-00000000-0000-4000-8000-000000000038"
  },
  {
    "transfer_id": "TRF-10000000-0000-4000-8000-00000000000a",
    "betrag": "450.00",
    "typ": "intern",
    "abgang_transaktion_id": "TXN-00000000-0000-4000-8000-000000000046",
    "zugang_transaktion_id": "TXN-00000000-0000-4000-8000-000000000047"
  },
  {
    "transfer_id": "TRF-10000000-0000-4000-8000-00000000000b",
    "betrag": "100.00",
    "typ": "intern",
    "abgang_transaktion_id": "TXN-00000000-0000-4000-8000-000000000048",
    "zugang_transaktion_id": "TXN-00000000-0000-4000-8000-000000000049"
  },
  {
    "transfer_id": "TRF-10000000-0000-4000-8000-00000000000c",
    "betrag": "280.00",
    "typ": "intern",
    "abgang_transaktion_id": "TXN-00000000-0000-4000-8000-00000000004a",
    "zugang_transaktion_id": "TXN-00000000-0000-4000-8000-00000000004b"
  },
  {
    "transfer_id": "TRF-10000000-0000-4000-8000-00000000000d",
    "betrag": "450.00",
    "typ": "intern",
    "abgang_transaktion_id": "TXN-00000000-0000-4000-8000-000000000058",
    "zugang_transaktion_id": "TXN-00000000-0000-4000-8000-000000000059"
  },
  {
    "transfer_id": "TRF-10000000-0000-4000-8000-00000000000e",
    "betrag": "100.00",
    "typ": "intern",
    "abgang_transaktion_id": "TXN-00000000-0000-4000-8000-00000000005a",
    "zugang_transaktion_id": "TXN-00000000-0000-4000-8000-00000000005b"
  },
  {
    "transfer_id": "TRF-10000000-0000-4000-8000-00000000000f",
    "betrag": "299.00",
    "typ": "intern",
    "abgang_transaktion_id": "TXN-00000000-0000-4000-8000-00000000005c",
    "zugang_transaktion_id": "TXN-00000000-0000-4000-8000-00000000005d"
  },
  {
    "transfer_id": "TRF-10000000-0000-4000-8000-000000000010",
    "betrag": "450.00",
    "typ": "intern",
    "abgang_transaktion_id": "TXN-00000000-0000-4000-8000-00000000006b",
    "zugang_transaktion_id": "TXN-00000000-0000-4000-8000-00000000006c"
  },
  {
    "transfer_id": "TRF-10000000-0000-4000-8000-000000000011",
    "betrag": "100.00",
    "typ": "intern",
    "abgang_transaktion_id": "TXN-00000000-0000-4000-8000-00000000006d",
    "zugang_transaktion_id": "TXN-00000000-0000-4000-8000-00000000006e"
  },
  {
    "transfer_id": "TRF-10000000-0000-4000-8000-000000000012",
    "betrag": "318.00",
    "typ": "intern",
    "abgang_transaktion_id": "TXN-00000000-0000-4000-8000-00000000006f",
    "zugang_transaktion_id": "TXN-00000000-0000-4000-8000-000000000070"
  },
  {
    "transfer_id": "TRF-10000000-0000-4000-8000-000000000013",
    "betrag": "450.00",
    "typ": "intern",
    "abgang_transaktion_id": "TXN-00000000-0000-4000-8000-00000000007e",
    "zugang_transaktion_id": "TXN-00000000-0000-4000-8000-00000000007f"
  },
  {
    "transfer_id": "TRF-10000000-0000-4000-8000-000000000014",
    "betrag": "100.00",
    "typ": "intern",
    "abgang_transaktion_id": "TXN-00000000-0000-4000-8000-000000000080",
    "zugang_transaktion_id": "TXN-00000000-0000-4000-8000-000000000081"
  },
  {
    "transfer_id": "TRF-10000000-0000-4000-8000-000000000015",
    "betrag": "310.00",
    "typ": "intern",
    "abgang_transaktion_id": "TXN-00000000-0000-4000-8000-000000000082",
    "zugang_transaktion_id": "TXN-00000000-0000-4000-8000-000000000083"
  },
  {
    "transfer_id": "TRF-10000000-0000-4000-8000-000000000016",
    "betrag": "450.00",
    "typ": "intern",
    "abgang_transaktion_id": "TXN-00000000-0000-4000-8000-000000000090",
    "zugang_transaktion_id": "TXN-00000000-0000-4000-8000-000000000091"
  },
  {
    "transfer_id": "TRF-10000000-0000-4000-8000-000000000017",
    "betrag": "100.00",
    "typ": "intern",
    "abgang_transaktion_id": "TXN-00000000-0000-4000-8000-000000000092",
    "zugang_transaktion_id": "TXN-00000000-0000-4000-8000-000000000093"
  },
  {
    "transfer_id": "TRF-10000000-0000-4000-8000-000000000018",
    "betrag": "329.00",
    "typ": "intern",
    "abgang_transaktion_id": "TXN-00000000-0000-4000-8000-000000000094",
    "zugang_transaktion_id": "TXN-00000000-0000-4000-8000-000000000095"
  },
  {
    "transfer_id": "TRF-10000000-0000-4000-8000-000000000019",
    "betrag": "450.00",
    "typ": "intern",
    "abgang_transaktion_id": "TXN-00000000-0000-4000-8000-0000000000a2",
    "zugang_transaktion_id": "TXN-00000000-0000-4000-8000-0000000000a3"
  },
  {
    "transfer_id": "TRF-10000000-0000-4000-8000-00000000001a",
    "betrag": "100.00",
    "typ": "intern",
    "abgang_transaktion_id": "TXN-00000000-0000-4000-8000-0000000000a4",
    "zugang_transaktion_id": "TXN-00000000-0000-4000-8000-0000000000a5"
  },
  {
    "transfer_id": "TRF-10000000-0000-4000-8000-00000000001b",
    "betrag": "348.00",
    "typ": "intern",
    "abgang_transaktion_id": "TXN-00000000-0000-4000-8000-0000000000a6",
    "zugang_transaktion_id": "TXN-00000000-0000-4000-8000-0000000000a7"
  },
  {
    "transfer_id": "TRF-10000000-0000-4000-8000-00000000001c",
    "betrag": "450.00",
    "typ": "intern",
    "abgang_transaktion_id": "TXN-00000000-0000-4000-8000-0000000000b5",
    "zugang_transaktion_id": "TXN-00000000-0000-4000-8000-0000000000b6"
  },
  {
    "transfer_id": "TRF-10000000-0000-4000-8000-00000000001d",
    "betrag": "100.00",
    "typ": "intern",
    "abgang_transaktion_id": "TXN-00000000-0000-4000-8000-0000000000b7",
    "zugang_transaktion_id": "TXN-00000000-0000-4000-8000-0000000000b8"
  },
  {
    "transfer_id": "TRF-10000000-0000-4000-8000-00000000001e",
    "betrag": "367.00",
    "typ": "intern",
    "abgang_transaktion_id": "TXN-00000000-0000-4000-8000-0000000000b9",
    "zugang_transaktion_id": "TXN-00000000-0000-4000-8000-0000000000ba"
  },
  {
    "transfer_id": "TRF-10000000-0000-4000-8000-00000000001f",
    "betrag": "450.00",
    "typ": "intern",
    "abgang_transaktion_id": "TXN-00000000-0000-4000-8000-0000000000c8",
    "zugang_transaktion_id": "TXN-00000000-0000-4000-8000-0000000000c9"
  },
  {
    "transfer_id": "TRF-10000000-0000-4000-8000-000000000020",
    "betrag": "100.00",
    "typ": "intern",
    "abgang_transaktion_id": "TXN-00000000-0000-4000-8000-0000000000ca",
    "zugang_transaktion_id": "TXN-00000000-0000-4000-8000-0000000000cb"
  },
  {
    "transfer_id": "TRF-10000000-0000-4000-8000-000000000021",
    "betrag": "386.00",
    "typ": "intern",
    "abgang_transaktion_id": "TXN-00000000-0000-4000-8000-0000000000cc",
    "zugang_transaktion_id": "TXN-00000000-0000-4000-8000-0000000000cd"
  },
  {
    "transfer_id": "TRF-10000000-0000-4000-8000-000000000022",
    "betrag": "450.00",
    "typ": "intern",
    "abgang_transaktion_id": "TXN-00000000-0000-4000-8000-0000000000da",
    "zugang_transaktion_id": "TXN-00000000-0000-4000-8000-0000000000db"
  },
  {
    "transfer_id": "TRF-10000000-0000-4000-8000-000000000023",
    "betrag": "100.00",
    "typ": "intern",
    "abgang_transaktion_id": "TXN-00000000-0000-4000-8000-0000000000dc",
    "zugang_transaktion_id": "TXN-00000000-0000-4000-8000-0000000000dd"
  },
  {
    "transfer_id": "TRF-10000000-0000-4000-8000-000000000024",
    "betrag": "405.00",
    "typ": "intern",
    "abgang_transaktion_id": "TXN-00000000-0000-4000-8000-0000000000de",
    "zugang_transaktion_id": "TXN-00000000-0000-4000-8000-0000000000df"
  },
  {
    "transfer_id": "TRF-10000000-0000-4000-8000-000000000025",
    "betrag": "450.00",
    "typ": "intern",
    "abgang_transaktion_id": "TXN-00000000-0000-4000-8000-0000000000ed",
    "zugang_transaktion_id": "TXN-00000000-0000-4000-8000-0000000000ee"
  },
  {
    "transfer_id": "TRF-10000000-0000-4000-8000-000000000026",
    "betrag": "100.00",
    "typ": "intern",
    "abgang_transaktion_id": "TXN-00000000-0000-4000-8000-0000000000ef",
    "zugang_transaktion_id": "TXN-00000000-0000-4000-8000-0000000000f0"
  },
  {